{
  "eidolon": "my-eidolon",
  "version": "0.1.0",
  "methodology": "MyEidolon",
  "installed_at": "2026-05-26T12:00:00Z",
  "target": "./.eidolons/my-eidolon",
  "hosts_wired": ["claude-code"],
  "spec_file": ".eidolons/my-eidolon/SPEC.md",
  "canonical_inventory_strict": true,
  "files_written": [
    {
      "path": "./.eidolons/my-eidolon/agent.md",
      "sha256": "0000000000000000000000000000000000000000000000000000000000000000",
      "role": "agent-profile",
      "mode": "created"
    },
    {
      "path": "./.eidolons/my-eidolon/SPEC.md",
      "sha256": "dad69201bf8e8e4f702af090ed4da713a2d3087da221ee1db615c73ee7f3b090",
      "role": "spec",
      "mode": "created"
    },
    {
      "path": "./.eidolons/my-eidolon/ECL_VERSION",
      "sha256": "aaaaaaaaaaaaaaaaaaaaaaaaaaaaaaaaaaaaaaaaaaaaaaaaaaaaaaaaaaaaaaaa",
      "role": "ecl-version",
      "mode": "created"
    },
    {
      "path": ".claude/agents/my-eidolon.md",
      "sha256": "1111111111111111111111111111111111111111111111111111111111111111",
      "role": "dispatch",
      "mode": "created"
    }
  ],
  "token_budget": {
    "entry": 420,
    "working_set_target": 1000
  }
}
