{"eidolon":"test","eiis_version":"3.0.0","version":"1.0.0","methodology":"TEST","installed_at":"2026-08-17T00:00:00Z","target":".eidolons/test","hosts_wired":["claude-code"],"persona_file":".eidolons/test/PERSONA.md","spec_file":".eidolons/test/SPEC.md","files_written":[{"path":".eidolons/test/PERSONA.md","sha256":"0000000000000000000000000000000000000000000000000000000000000000","role":"persona"},{"path":".eidolons/test/SPEC.md","sha256":"0000000000000000000000000000000000000000000000000000000000000000","role":"spec"}]}
